{
  "schema_version": 1,
  "id": "example-bank",
  "slug": "example-bank",
  "name": "Example Bank",
  "sector": "Banking & Finance",
  "ats_type": "workday",
  "source_url": "https://examplebank.wd3.myworkdayjobs.com/ExampleBankCareers",
  "active": true,
  "tracked_since": "2026-09-28",
  "tracked_days": 128,
  "has_data": true,
  "last_run": {
    "date": "2027-02-03",
    "time": "06:12",
    "status": "ok"
  },
  "last_successful_check_at": "2027-02-03T06:12:00+02:00",
  "consecutive_failed_runs": 0,
  "check_status": "ok",
  "total_listings_seen": 10,
  "metrics": {
    "open_count": {
      "value": 7,
      "unit": "count",
      "numerator": null,
      "denominator": null,
      "window_label": null,
      "window_start": null,
      "available": true,
      "unavailable_reason": null,
      "available_from": null
    },
    "median_days_seen": {
      "value": 55,
      "unit": "days",
      "numerator": null,
      "denominator": null,
      "window_label": null,
      "window_start": null,
      "available": true,
      "unavailable_reason": null,
      "available_from": null
    },
    "share_open_90": {
      "value": 29,
      "unit": "percent",
      "numerator": 2,
      "denominator": 7,
      "window_label": null,
      "window_start": null,
      "available": true,
      "unavailable_reason": null,
      "available_from": null
    },
    "repost_rate": {
      "value": 20,
      "unit": "percent",
      "numerator": 2,
      "denominator": 10,
      "window_label": "since 28 Sep 2026",
      "window_start": "2026-09-28",
      "available": true,
      "unavailable_reason": null,
      "available_from": null
    },
    "long_open_possible_from": null
  },
  "overview": {
    "eligible": true,
    "eligible_from": "2026-12-28",
    "reason": null
  },
  "listings": {
    "open": [
      {
        "listing_id": "zh52c8791m",
        "employer_slug": "example-bank",
        "employer_name": "Example Bank",
        "title": "IT Intern",
        "location": "Centurion",
        "first_seen": "2027-01-31",
        "last_seen": "2027-02-03",
        "days_seen": 3,
        "status": "open",
        "closed_on": null,
        "age_state": "fresh",
        "open_before_tracking": false,
        "reposted": false,
        "repost_count": 0,
        "chain_first_seen": null
      },
      {
        "listing_id": "1q5hkhev1v",
        "employer_slug": "example-bank",
        "employer_name": "Example Bank",
        "title": "Branch Consultant",
        "location": "Polokwane",
        "first_seen": "2027-01-27",
        "last_seen": "2027-02-03",
        "days_seen": 7,
        "status": "open",
        "closed_on": null,
        "age_state": "fresh",
        "open_before_tracking": false,
        "reposted": false,
        "repost_count": 0,
        "chain_first_seen": null
      },
      {
        "listing_id": "ha7g2x9rad",
        "employer_slug": "example-bank",
        "employer_name": "Example Bank",
        "title": "Data Analyst",
        "location": "Sandton",
        "first_seen": "2027-01-20",
        "last_seen": "2027-02-03",
        "days_seen": 14,
        "status": "open",
        "closed_on": null,
        "age_state": "seen",
        "open_before_tracking": false,
        "reposted": true,
        "repost_count": 2,
        "chain_first_seen": "2026-10-05"
      },
      {
        "listing_id": "52mv7gd58g",
        "employer_slug": "example-bank",
        "employer_name": "Example Bank",
        "title": "Cloud Engineer",
        "location": "Remote",
        "first_seen": "2026-12-10",
        "last_seen": "2027-02-03",
        "days_seen": 55,
        "status": "open",
        "closed_on": null,
        "age_state": "seen",
        "open_before_tracking": false,
        "reposted": false,
        "repost_count": 0,
        "chain_first_seen": null
      },
      {
        "listing_id": "pvwm3w62dv",
        "employer_slug": "example-bank",
        "employer_name": "Example Bank",
        "title": "Actuarial Analyst",
        "location": "Cape Town",
        "first_seen": "2026-11-16",
        "last_seen": "2027-02-03",
        "days_seen": 79,
        "status": "open",
        "closed_on": null,
        "age_state": "seen",
        "open_before_tracking": false,
        "reposted": false,
        "repost_count": 0,
        "chain_first_seen": null
      },
      {
        "listing_id": "7md14shwt8",
        "employer_slug": "example-bank",
        "employer_name": "Example Bank",
        "title": "Finance Intern 2027",
        "location": "Johannesburg",
        "first_seen": "2026-10-20",
        "last_seen": "2027-02-03",
        "days_seen": 106,
        "status": "open",
        "closed_on": null,
        "age_state": "long_open",
        "open_before_tracking": false,
        "reposted": false,
        "repost_count": 0,
        "chain_first_seen": null
      },
      {
        "listing_id": "8bncrtw7e6",
        "employer_slug": "example-bank",
        "employer_name": "Example Bank",
        "title": "Graduate Programme 2027",
        "location": "Johannesburg",
        "first_seen": "2026-09-28",
        "last_seen": "2027-02-03",
        "days_seen": 128,
        "status": "open",
        "closed_on": null,
        "age_state": "long_open",
        "open_before_tracking": true,
        "reposted": false,
        "repost_count": 0,
        "chain_first_seen": null
      }
    ],
    "recently_closed": [
      {
        "listing_id": "2ga75cqsm0",
        "employer_slug": "example-bank",
        "employer_name": "Example Bank",
        "title": "Credit Risk Analyst",
        "location": "Johannesburg",
        "first_seen": "2026-11-02",
        "last_seen": "2027-01-12",
        "days_seen": 71,
        "status": "closed",
        "closed_on": "2027-01-14",
        "age_state": "closed",
        "open_before_tracking": false,
        "reposted": false,
        "repost_count": 0,
        "chain_first_seen": null
      },
      {
        "listing_id": "bmqvzc53r8",
        "employer_slug": "example-bank",
        "employer_name": "Example Bank",
        "title": "Data Analyst",
        "location": "Sandton",
        "first_seen": "2026-12-01",
        "last_seen": "2027-01-05",
        "days_seen": 35,
        "status": "closed",
        "closed_on": "2027-01-07",
        "age_state": "closed",
        "open_before_tracking": false,
        "reposted": true,
        "repost_count": 1,
        "chain_first_seen": "2026-10-05"
      },
      {
        "listing_id": "znyevd73vn",
        "employer_slug": "example-bank",
        "employer_name": "Example Bank",
        "title": "Data Analyst",
        "location": "Sandton",
        "first_seen": "2026-10-05",
        "last_seen": "2026-11-10",
        "days_seen": 36,
        "status": "closed",
        "closed_on": "2026-11-12",
        "age_state": "closed",
        "open_before_tracking": false,
        "reposted": false,
        "repost_count": 0,
        "chain_first_seen": null
      }
    ]
  }
}
